{
  "subject": "math",
  "slug": "01-dvor-maks-ploshchadi",
  "title": "Ауданы ең үлкен аула жобала",
  "skill": "Туынды және оңтайландыру",
  "minutes": 12,
  "language": "kk",
  "status": "draft",
  "variable": "x",
  "story": "40 метр қоршау бар. Ішінде орын барынша көп болуы үшін тіктөртбұрышты ауланың өлшемдерін тап.",
  "material": "Периметрі P тіктөртбұрыш үшін: екінші қабырға y = P/2 − x, аудан S(x) = x(P/2 − x), мұнда 0 < x < P/2. S(x) = ax − x² үшін туынды S′(x) = a − 2x. Оң туынды өсуді, теріс туынды кемуді білдіреді. Максимум туынды нөлге тең болып, таңбасын «+»-тан «−»-ке өзгертетін жерде; S″(x) = −2 < 0 екенін де тексеруге болады. Қабырғалар метрмен, аудан шаршы метрмен өлшенеді. Қорытынды: S(x) = x(20 − x), S′(x) = 20 − 2x; x = 10 болғанда туынды таңбасын плюстен минусқа өзгертеді, сондықтан бұл — максимум.",
  "steps": [
    {
      "id": "s1",
      "title": "Шартты функцияға айналдыр",
      "prompt": "Тіктөртбұрыштың периметрі — 40 м. Бір қабырғасы x-ке тең, демек екіншісі 20 − x-ке тең. Ауданды қалай өрнектейміз?",
      "answer_type": "choice",
      "options": [
        "S(x) = 40x",
        "S(x) = x(20 − x)",
        "S(x) = x + 20"
      ],
      "expected": 1,
      "hints": [
        "Тіктөртбұрыштың ауданы — қабырғалардың көбейтіндісі.",
        "Бір қабырғасы x, екіншісі 20 − x болса, ауланың қабырғалары қандай?",
        "Мысал: қабырғалары x және 15 − x болса, аудан S = x(15 − x)."
      ],
      "simple": "Тіктөртбұрыштың екі жұп қабырғасы бар. Олардың қосындысы 40 м болса, бір ұзындық пен бір ен 20 м береді.",
      "free_input": [
        {
          "prompt": "Периметр 40 м, бір қабырғасы x. Екінші қабырғасы неге тең?",
          "answer_type": "formula",
          "expected": "20 - x"
        },
        {
          "prompt": "Ауланың S ауданын x арқылы жаз.",
          "answer_type": "formula",
          "expected": "x*(20 - x)"
        }
      ]
    },
    {
      "id": "s2",
      "title": "Тексеретін нүктені тап",
      "prompt": "S(x) = 20x − x² үшін туынды S′(x) = 20 − 2x. x қандай болғанда туынды нөлге тең?",
      "answer_type": "choice",
      "options": [
        "x = 20",
        "x = 5",
        "x = 10"
      ],
      "expected": 2,
      "hints": [
        "Максимумды туынды нөлге тең болатын жерден іздейді.",
        "20 − 2x = 0 теңдеуін шеш: 2x-ті оң жаққа шығарсаң не шығады?",
        "Мысал: 30 − 2x = 0 → 2x = 30 → x = 15."
      ],
      "simple": "Туынды x сәл өскенде аудан өсетінін көрсетеді. Нөл — тексеруге тұрарлық орын.",
      "free_input": [
        {
          "prompt": "S(x) = 20x − x² функциясының туындысын тап.",
          "answer_type": "formula",
          "expected": "20 - 2*x"
        }
      ]
    },
    {
      "id": "s3",
      "title": "Ауланың ең тиімді пішінін тап",
      "prompt": "x қабырғасының жүгіргісін жылжыт — екінші қабырға автоматты түрде 20 − x-ке тең, периметр 40 м болып қалады. x қандай болғанда аудан ең үлкен болады, м?",
      "answer_type": "number",
      "expected": {
        "value": 10,
        "tolerance": 0.01
      },
      "solution": "S(x) = 20x − x². S′(x) = 20 − 2x = 0 → x = 10. x < 10 болғанда S′ > 0, x > 10 болғанда S′ < 0 — демек, бұл максимум. Аула 10 × 10 м, S = 100 м².",
      "hints": [
        "Жүгіргіні жылжытып, «S өзгерісі» жолын бақыла.",
        "x қандай болғанда аудан өсуін тоқтатып, кеми бастайды?",
        "Мысал: 30 м қоршау үшін максимум x = 7,5 болғанда — екі қабырға тең."
      ],
      "simple": "Тар аулада орын аз. Периметр тұрақты болғанда ең үлкен ауданды квадрат береді.",
      "common_mistakes": [
        {
          "pattern": "20",
          "feedback": "x = 20 болғанда екінші қабырға 0-ге тең — аула жоқ."
        },
        {
          "pattern": "100",
          "feedback": "100 — бұл аудан. Ал x қабырғасының ұзындығы керек."
        }
      ]
    },
    {
      "id": "s4",
      "title": "Үйдің жанындағы аула",
      "independent": true,
      "prompt": "Аула үйдің қабырғасына жапсарлас, сондықтан қоршау тек үш жағынан керек — 60 м. Ұзындығы x екі қабырға үйден шығады, үшінші қабырға үйдің бойымен өтеді және 60 − 2x-ке тең. S(x) = x(60 − 2x). x қандай болғанда аудан ең үлкен болады?",
      "answer_type": "choice",
      "options": [
        "10 м",
        "20 м",
        "15 м"
      ],
      "expected": 2,
      "number_part": {
        "label": "Ауланың ең үлкен ауданы, м²",
        "expected": {
          "value": 450,
          "tolerance": 0.5
        }
      },
      "solution": "S(x) = 60x − 2x². S′(x) = 60 − 4x = 0 → x = 15. Үйдің бойымен 60 − 30 = 30 м. S = 15 · 30 = 450 м². Үйдің жанында квадрат емес, 1 : 2 тіктөртбұрыш тиімдірек.",
      "hints": [],
      "variants": [
        {
          "prompt": "Қоршау 80 м, аула үйдің жанында (үш жағы). S(x) = x(80 − 2x). x қандай болғанда аудан ең үлкен болады?",
          "options": [
            "20 м",
            "40 м",
            "10 м"
          ],
          "expected": 0,
          "number_part": {
            "label": "Ауланың ең үлкен ауданы, м²",
            "expected": {
              "value": 800,
              "tolerance": 0.5
            }
          }
        },
        {
          "prompt": "Қоршау 60 м, төрт жағынан. S(x) = x(30 − x), S′(x) = 30 − 2x. x қандай болғанда аудан ең үлкен болады?",
          "options": [
            "10 м",
            "30 м",
            "15 м"
          ],
          "expected": 2,
          "number_part": {
            "label": "Ауланың ең үлкен ауданы, м²",
            "expected": {
              "value": 225,
              "tolerance": 0.5
            }
          }
        }
      ],
      "free_input": [
        {
          "prompt": "Аула үйдің жанында, қоршау үш жағынан 60 м. Ең үлкен аудан қандай болуы мүмкін, м²?",
          "answer_type": "number",
          "expected": {
            "value": 450,
            "tolerance": 0.5
          }
        }
      ]
    }
  ]
}
