{
  "subject": "python",
  "slug": "01-skidka-v-kafe",
  "title": "Студенттік кафедегі жеңілдікті түзет",
  "skill": "Шарттар және шекаралық мәндер",
  "minutes": 10,
  "language": "kk",
  "status": "draft",
  "story": "Кафеде 1 000 ₸ және одан жоғары тапсырысқа 10% жеңілдік беріледі. Касса қателеседі: дәл 1 000 ₸ тапсырысқа жеңілдік жоқ. Шарттағы қатені тап.",
  "material": "if шарты «иә» немесе «жоқ» деп жауап берілетін сұрақты тексереді. Шарт ақиқат болса, if блогы орындалады, әйтпесе — else блогы. Салыстыру белгілері: > — үлкен; >= — үлкен немесе тең; < — кіші; == — тең (бір = белгісі — мән беру). «1 000-нан бастап» 1 000-ды қамтиды, сондықтан >= керек. 10% жеңілдіктен кейін бағаның 90%-ы қалады: pay = total × 0.9. 1000 шегі үшін 999, 1000 және 1001-ді, содан кейін кәдімгі соманы, мысалы 1500-ді тексереді. Қорытынды: > белгісі «қатаң үлкен», ал >= — «үлкен немесе тең» дегенді білдіреді. Әрқашан шекараның өзін тексер.",
  "steps": [
    {
      "id": "s1",
      "title": "Бағдарлама шешімді қалай қабылдайды?",
      "prompt": "Кафеде 1 000 ₸ және одан жоғары тапсырысқа 10% жеңілдік беріледі. Бағдарлама нені тексеруі керек?",
      "answer_type": "choice",
      "options": [
        "Тапсырыс сомасы 1 000 ₸-ден кем емес",
        "Сатып алушының аты",
        "Бағдарламадағы жолдар саны"
      ],
      "expected": 0,
      "hints": [
        "Жеңілдік чектегі бір ғана санға байланысты.",
        "Ережеде жеңілдік неге байланысты — адамға ма, әлде сомаға ма?",
        "Мысал: «5 000 ₸-ден бастап тегін жеткізу» — тапсырыс сомасын тексереміз."
      ],
      "simple": "Жаңбыр жауса, қолшатыр аламыз. Әйтпесе онсыз барамыз. Бұл — шарттың екі тармағы."
    },
    {
      "id": "s2",
      "title": "Мың — жеңілдікпен бе?",
      "prompt": "Тапсырыс дәл 1 000 ₸ тұрады. Дәл осы код қандай соманы есептейді?",
      "code": "total = 1000\nif total > 1000:\n    pay = total * 0.9\nelse:\n    pay = total",
      "answer_type": "choice",
      "options": [
        "900 ₸ — жеңілдік қолданылады",
        "1 000 ₸ — жеңілдік болмайды",
        "100 ₸ — тек жеңілдік қалады"
      ],
      "expected": 1,
      "hints": [
        "> белгісі «қатаң үлкен» дегенді білдіреді.",
        "1000 > 1000 дұрыс па?",
        "Мысал: age = 18 болғанда age > 18 шарты жалған — else тармағы орындалады."
      ],
      "simple": "«16-дан үлкен» 16 жасты қамтымайды. «16 және одан үлкен» қамтиды.",
      "common_mistakes": [
        {
          "pattern": "0",
          "feedback": "1000 саны 1000-нан үлкен емес — шарт жалған, код else тармағын таңдайды және жеңілдік болмайды."
        },
        {
          "pattern": "2",
          "feedback": "Жеңілдік бағаны 10%-ға азайтады, тек жеңілдіктің өзін қалдырмайды."
        }
      ]
    },
    {
      "id": "s3",
      "title": "Кассаны түзет",
      "prompt": "10% жеңілдік сома 1 000 ₸ және одан жоғары болғанда берілуі үшін салыстыру белгісін таңда. Касса оны төрт тапсырыста тексереді.",
      "code": "total = тапсырыс_сомасы\nif total ___ 1000:\n    pay = total * 0.9\nelse:\n    pay = total",
      "answer_type": "choice",
      "options": [
        ">",
        ">=",
        "<",
        "=="
      ],
      "expected": 1,
      "checks": [
        {
          "input": 999,
          "expect": 999
        },
        {
          "input": 1000,
          "expect": 900
        },
        {
          "input": 1001,
          "expect": 900.9
        },
        {
          "input": 1500,
          "expect": 1350
        }
      ],
      "lab": {
        "kind": "threshold",
        "title": "Кассаны сынап көр",
        "label": "Тапсырыс сомасы, ₸",
        "unit": "₸",
        "threshold": 1000,
        "then_factor": 0.9,
        "presets": [999, 1000, 1001, 1500]
      },
      "hints": [
        "«1 000-нан бастап» — демек, 1 000 те жарайды.",
        "Қай белгі шекараның өзін қамтиды?",
        "Мысал: «18 жастан бастап» кодта age >= 18 деп жазылады."
      ],
      "simple": "Көршілес үш соманы тексер: 999, 1000 және 1001. Тек біріншісі жеңілдіксіз қалуы керек.",
      "free_input": [
        {
          "prompt": "Жеңілдік 1 000 ₸ және одан жоғары тапсырыстарға қолданылуы үшін функцияны түзет.",
          "answer_type": "code",
          "starter_code": "def final_price(total):\n    if total > 1000:\n        return total * 0.9\n    return total\n",
          "tests": [
            {
              "call": "final_price(999)",
              "expect": 999
            },
            {
              "call": "final_price(1000)",
              "expect": 900.0
            },
            {
              "call": "final_price(1001)",
              "expect": 900.9
            },
            {
              "call": "final_price(1500)",
              "expect": 1350.0
            }
          ],
          "solution": "Шекара ережеге кіреді, сондықтан > белгісін >= белгісіне ауыстырамыз."
        }
      ]
    },
    {
      "id": "s4",
      "title": "Жеткізу: жаңа шекара",
      "independent": true,
      "prompt": "Тегін жеткізу 2 000 ₸ және одан жоғары тапсырысқа беріледі. Қалған жағдайда ол 200 ₸ тұрады. Қай шарт тегін жеткізуді қамтиды?",
      "answer_type": "choice",
      "options": [
        "total > 2000",
        "total >= 2000",
        "total < 2000"
      ],
      "expected": 1,
      "number_part": {
        "label": "Жеткізумен бірге 1 500 ₸ тапсырыстың сомасы, ₸",
        "expected": {
          "value": 1700,
          "tolerance": 0
        }
      },
      "solution": "Шекара қосылады — >= керек. 1 500 ₸ тапсырыс 2 000 ₸-ден аз, сондықтан 200 ₸ жеткізу қосылады: 1 700 ₸.",
      "hints": [],
      "variants": [
        {
          "prompt": "Тегін жеткізу — 5 000 ₸ және одан жоғары, әйтпесе 700 ₸. Қай шарт тегін жеткізуді қамтиды?",
          "options": [
            "total > 5000",
            "total >= 5000",
            "total < 5000"
          ],
          "expected": 1,
          "number_part": {
            "label": "Жеткізумен бірге 4 000 ₸ тапсырыстың сомасы, ₸",
            "expected": {
              "value": 4700,
              "tolerance": 0
            }
          }
        },
        {
          "prompt": "500 ₸ бонус — 3 000 ₸ және одан жоғары сатып алуға беріледі. Қай шарт бонус береді?",
          "options": [
            "total > 3000",
            "total >= 3000",
            "total == 3000"
          ],
          "expected": 1,
          "number_part": {
            "label": "3 000 ₸ сатып алуға берілетін бонус, ₸",
            "expected": {
              "value": 500,
              "tolerance": 0
            }
          }
        }
      ],
      "free_input": [
        {
          "prompt": "Жеткізу 2 000 ₸-ден бастап тегін, әйтпесе 200 ₸. delivery_cost(total) функциясын жаз.",
          "answer_type": "code",
          "starter_code": "def delivery_cost(total):\n    pass\n",
          "tests": [
            {
              "call": "delivery_cost(1999)",
              "expect": 200
            },
            {
              "call": "delivery_cost(2000)",
              "expect": 0
            },
            {
              "call": "delivery_cost(3500)",
              "expect": 0
            }
          ]
        }
      ]
    }
  ]
}
