{
  "subject": "math",
  "slug": "01-dvor-maks-ploshchadi",
  "title": "Спроектируй двор с самой большой площадью",
  "skill": "Производная и оптимизация",
  "minutes": 12,
  "language": "ru",
  "status": "draft",
  "story": "Есть 40 метров ограждения. Найди размеры прямоугольного двора, чтобы внутри было больше всего места.",
  "material": "Периметр прямоугольника P = 2(a + b). Площадь S = a·b. Максимум функции ищут там, где производная равна нулю и меняет знак с «+» на «−».",
  "steps": [
    {
      "id": "s1",
      "title": "Одна переменная",
      "prompt": "Периметр 40 м, одна сторона a. Чему равна другая сторона b?",
      "answer_type": "formula",
      "expected": "20 - a",
      "hints": [
        "Сумма двух соседних сторон — половина периметра.",
        "Чему равно a + b, если 2(a + b) = 40?",
        "Пример: периметр 30 → a + b = 15 → b = 15 − a."
      ]
    },
    {
      "id": "s2",
      "title": "Площадь как функция",
      "prompt": "Запиши площадь двора S через a.",
      "answer_type": "formula",
      "expected": "a*(20 - a)",
      "hints": [
        "Площадь — произведение сторон.",
        "Подставь b из шага 1 в S = a·b.",
        "Пример: при b = 15 − a площадь S = a(15 − a)."
      ]
    },
    {
      "id": "s3",
      "title": "Где максимум?",
      "prompt": "Найди a, при котором площадь наибольшая. Ответ — число (метры).",
      "answer_type": "number",
      "expected": { "value": 10, "tolerance": 0.01 },
      "solution": "S(a) = 20a − a². S'(a) = 20 − 2a = 0 → a = 10. При a < 10 S' > 0, при a > 10 S' < 0 — значит, максимум. Двор 10 × 10 м, S = 100 м².",
      "hints": [
        "Максимум там, где производная равна нулю.",
        "Чему равна производная от 20a − a²?",
        "Пример: для S = 30a − a² производная 30 − 2a = 0 → a = 15."
      ],
      "common_mistakes": [
        { "pattern": "20", "feedback": "При a = 20 вторая сторона равна 0 — двора нет." },
        { "pattern": "100", "feedback": "100 — это площадь. А нужна длина стороны a." }
      ]
    },
    {
      "id": "s4",
      "title": "Новая задача",
      "independent": true,
      "prompt": "Двор примыкает к стене дома, ограждение нужно только с трёх сторон — 60 м. Какой наибольшей может быть площадь (м²)?",
      "answer_type": "number",
      "expected": { "value": 450, "tolerance": 0.5 },
      "solution": "Стороны a, a и 60 − 2a. S = a(60 − 2a) = 60a − 2a². S' = 60 − 4a = 0 → a = 15. S = 15 · 30 = 450 м².",
      "hints": [],
      "variants": [
        { "prompt": "Ограждение 80 м, двор у стены (три стороны). Наибольшая площадь, м²?", "expected": { "value": 800, "tolerance": 0.5 } }
      ]
    }
  ]
}
